{
  "schema": "ragy.consumer.tensor-record",
  "configuration": "2a42f7623fba1fe4de8a5883131b5657a1fbc3bb59f56c61c940cf74b053a518",
  "scope": "policy",
  "publication": "082f425b10bbe62da4a55a79ea454535cd00b8919ded7350d757ddb80b03d679",
  "candidate_budget": 100,
  "candidate_ids": [
    "b9e572990e0dc751ebb5c5cc719b0a14dd14638eb62fd1531aa9577dc881c748",
    "b94727f69f2dad85bf2de5b109d6d0f58eaac633a77677aae87ce1fbc348cb1e",
    "655ffe5ded8453cb47a568be7c4e6f187eb12991202f71e4056f94c74f75dbc3"
  ],
  "candidate_document_ids": [
    "d418e0ad8724fe6210c6808b6b6536b9e6e6678a28aea0b0b2cba263b6ccf329",
    "103199c3e4191c2f3dd4eac658fa188e614f97c8319e95bfb95755d3ba6be591",
    "877ea10d43faa64e8116bdb6779a2991f13f7d57cf772664afde0491ce4a5322"
  ],
  "record": {
    "schema": "ragy.retrieval-evidence",
    "retrieval_id": {
      "state": "observed",
      "value": "tensor-record"
    },
    "scope": {
      "state": "observed",
      "value": "policy"
    },
    "publication": {
      "state": "observed",
      "value": "082f425b10bbe62da4a55a79ea454535cd00b8919ded7350d757ddb80b03d679"
    },
    "recipe": {
      "state": "observed",
      "value": "2a42f7623fba1fe4de8a5883131b5657a1fbc3bb59f56c61c940cf74b053a518"
    },
    "query": {
      "state": "omitted",
      "value": null
    },
    "outcome": "complete",
    "reason": "none",
    "coverage": {
      "schema": "ragy.read-coverage/admission",
      "state": "complete",
      "skipped_branches": null
    },
    "stages": [
      {
        "index": 0,
        "name": {
          "state": "observed",
          "value": "dense-candidates"
        },
        "status": "observed",
        "hits_state": "observed",
        "hits": [
          {
            "id": {
              "state": "observed",
              "value": "d418e0ad8724fe6210c6808b6b6536b9e6e6678a28aea0b0b2cba263b6ccf329"
            },
            "rank": {
              "state": "observed",
              "value": 1
            },
            "score": {
              "state": "native",
              "value": 1,
              "semantics": {
                "state": "observed",
                "value": "dense.normalized-dot:5ac5a3c77b49db26d3f04195d0fc112ce9826ed9fbeb898f57297f555b65262b"
              }
            },
            "snippet": {
              "state": "omitted",
              "value": null
            },
            "sources_state": "observed",
            "sources": [
              {
                "namespace": {
                  "state": "observed",
                  "value": "fixture-a"
                },
                "id": {
                  "state": "observed",
                  "value": "policy"
                },
                "revision": {
                  "state": "observed",
                  "value": "r1"
                },
                "transformation": {
                  "state": "observed",
                  "value": "ingest"
                },
                "artifact": {
                  "state": "observed",
                  "value": "t2"
                },
                "representation": {
                  "state": "observed",
                  "value": "utf8"
                }
              }
            ],
            "judgment": {
              "state": "ungradable",
              "query": {
                "state": "unavailable",
                "value": null
              },
              "source": {
                "namespace": {
                  "state": "unavailable",
                  "value": null
                },
                "id": {
                  "state": "unavailable",
                  "value": null
                },
                "revision": {
                  "state": "unavailable",
                  "value": null
                },
                "transformation": {
                  "state": "unavailable",
                  "value": null
                },
                "artifact": {
                  "state": "unavailable",
                  "value": null
                },
                "representation": {
                  "state": "unavailable",
                  "value": null
                }
              },
              "grade": {
                "state": "unavailable",
                "value": null
              },
              "rubric": {
                "state": "unavailable",
                "value": null
              }
            },
            "locations_state": "observed",
            "locations": [
              {
                "source": {
                  "namespace": {
                    "state": "observed",
                    "value": "fixture-a"
                  },
                  "id": {
                    "state": "observed",
                    "value": "policy"
                  },
                  "revision": {
                    "state": "observed",
                    "value": "r1"
                  },
                  "transformation": {
                    "state": "observed",
                    "value": "ingest"
                  },
                  "artifact": {
                    "state": "observed",
                    "value": "t2"
                  },
                  "representation": {
                    "state": "observed",
                    "value": "utf8"
                  }
                },
                "kind": "text",
                "span": {
                  "start": 0,
                  "end": 19
                },
                "page": {
                  "physical_index": 0,
                  "printed_label": "",
                  "width_pt": 0,
                  "height_pt": 0,
                  "rotation_deg": 0
                },
                "region": {
                  "left": 0,
                  "top": 0,
                  "right": 0,
                  "bottom": 0
                },
                "cell": {
                  "table": "",
                  "element": "",
                  "row": 0,
                  "column": 0,
                  "row_span": 0,
                  "column_span": 0
                }
              }
            ],
            "contributions_state": "unavailable",
            "contributions": null
          },
          {
            "id": {
              "state": "observed",
              "value": "103199c3e4191c2f3dd4eac658fa188e614f97c8319e95bfb95755d3ba6be591"
            },
            "rank": {
              "state": "observed",
              "value": 2
            },
            "score": {
              "state": "native",
              "value": 0,
              "semantics": {
                "state": "observed",
                "value": "dense.normalized-dot:5ac5a3c77b49db26d3f04195d0fc112ce9826ed9fbeb898f57297f555b65262b"
              }
            },
            "snippet": {
              "state": "omitted",
              "value": null
            },
            "sources_state": "observed",
            "sources": [
              {
                "namespace": {
                  "state": "observed",
                  "value": "fixture-a"
                },
                "id": {
                  "state": "observed",
                  "value": "policy"
                },
                "revision": {
                  "state": "observed",
                  "value": "r1"
                },
                "transformation": {
                  "state": "observed",
                  "value": "ingest"
                },
                "artifact": {
                  "state": "observed",
                  "value": "t1"
                },
                "representation": {
                  "state": "observed",
                  "value": "utf8"
                }
              }
            ],
            "judgment": {
              "state": "ungradable",
              "query": {
                "state": "unavailable",
                "value": null
              },
              "source": {
                "namespace": {
                  "state": "unavailable",
                  "value": null
                },
                "id": {
                  "state": "unavailable",
                  "value": null
                },
                "revision": {
                  "state": "unavailable",
                  "value": null
                },
                "transformation": {
                  "state": "unavailable",
                  "value": null
                },
                "artifact": {
                  "state": "unavailable",
                  "value": null
                },
                "representation": {
                  "state": "unavailable",
                  "value": null
                }
              },
              "grade": {
                "state": "unavailable",
                "value": null
              },
              "rubric": {
                "state": "unavailable",
                "value": null
              }
            },
            "locations_state": "observed",
            "locations": [
              {
                "source": {
                  "namespace": {
                    "state": "observed",
                    "value": "fixture-a"
                  },
                  "id": {
                    "state": "observed",
                    "value": "policy"
                  },
                  "revision": {
                    "state": "observed",
                    "value": "r1"
                  },
                  "transformation": {
                    "state": "observed",
                    "value": "ingest"
                  },
                  "artifact": {
                    "state": "observed",
                    "value": "t1"
                  },
                  "representation": {
                    "state": "observed",
                    "value": "utf8"
                  }
                },
                "kind": "text",
                "span": {
                  "start": 0,